{
  "failure_id": "11111111-1111-4111-8111-111111111111",
  "failed_at": "2026-10-18T15:00:00Z",
  "consumer_group": "inventario-v1",
  "original_topic": "credimarket.inventario.comandos.v1",
  "original_partition": 0,
  "original_offset": 10,
  "original_key": "11111111-1111-4111-8111-111111111111",
  "original_value_base64": "bm90LWpzb24=",
  "event_id": null,
  "attempts": 1,
  "error_code": "INVALID_JSON",
  "error_message": "No se puede decodificar el mensaje"
}
